{
  "status": "reject",
  "quality_score": 49.0,
  "hard_failures": [],
  "dimension_scores": {
    "adequacy": 0.0,
    "technical_accuracy": 80.0,
    "completeness": 60.0,
    "terminology": 80.0,
    "fluency": 0.0,
    "publishing_integrity": 100.0,
    "style_locale": 60.0
  },
  "issues": [
    {
      "id": "QL-001",
      "category": "technical",
      "severity": "major",
      "message": "number/unit token mismatch.",
      "segment_id": "",
      "source_span": "1",
      "target_span": "",
      "suggested_fix": "Preserve source number/unit token exactly.",
      "reason": "Review gate exact-match validator failed: missing=['1']",
      "guide_rule": "",
      "guide_section": ""
    },
    {
      "id": "QL-002",
      "category": "accuracy",
      "severity": "major",
      "message": "Duplicate target segments detected.",
      "segment_id": "",
      "source_span": "",
      "target_span": "다음으로, dispatcher space 자체에서 github app을 생성하고 설치합니다. 이 app은 대기 중인 워크플로우 작업을 수신하고 임시 셀프호스드 러너 등록 토큰을 생성할 수 있는 권한이 필요합니다.",
      "suggested_fix": "Remove repeated translated segments unless the source intentionally repeats them.",
      "reason": "Duplicate detector found repeated normalized target segments.",
      "guide_rule": "",
      "guide_section": ""
    },
    {
      "id": "QL-003",
      "category": "accuracy",
      "severity": "major",
      "message": "QE metric score is low.",
      "segment_id": "p_033",
      "source_span": "",
      "target_span": "0.4664",
      "suggested_fix": "Review this segment for omission, unrelated translation, or over-compression.",
      "reason": "QE score is below threshold 0.55.",
      "guide_rule": "",
      "guide_section": ""
    },
    {
      "id": "QL-004",
      "category": "terminology",
      "severity": "major",
      "message": "Product or library name was not preserved.",
      "segment_id": "",
      "source_span": "Datasets",
      "target_span": "",
      "suggested_fix": "Preserve `Datasets` exactly.",
      "reason": "Glossary policy requires preserving this product/library/model term.",
      "guide_rule": "",
      "guide_section": ""
    },
    {
      "id": "QL-005",
      "category": "style_locale",
      "severity": "minor",
      "message": "List mixes sentence-style and phrase-style endings.",
      "segment_id": "",
      "source_span": "",
      "target_span": "phrase, phrase, phrase, phrase, sentence, sentence, sentence, sentence, sentence",
      "suggested_fix": "Use either sentence-style endings or phrase-style endings consistently within one list.",
      "reason": "The style guide requires consistent list item endings.",
      "guide_rule": "list_consistency",
      "guide_section": "16. 리스트: 끝맺음과 정보 단위를 통일합니다"
    },
    {
      "id": "QL-006",
      "category": "accuracy",
      "severity": "major",
      "message": "Modal or certainty strength may have changed.",
      "segment_id": "p_003",
      "source_span": "can",
      "target_span": "그 기본 설정은 편리하지만 한계도 있습니다. GitHub Actions는 느려지거나 유지 보수로 다운될 수 있고, 호스팅 머신은 일반적이며, GPU 접근은 대부분의 오픈 소스 프로젝트에서 바로 활성화하기 어렵습니다. Trackio의 경우 이러한 한계가 점점 문제로 다가왔습니다. 기본 단위 테스트와 프런트엔드 확인을 위한 안정적인 CPU CI는 물론 실제 CUDA 하드웨어에서 실행해야 하는 테스트를 위한 GPU CI도 원했습니다.",
      "suggested_fix": "Preserve the strength of `can` using: 수 있습니다.",
      "reason": "The style guide requires preserving may/can/should/must/up to/in some cases/not always strength.",
      "guide_rule": "modal_strength",
      "guide_section": "4. 의미·조건·확신의 강도는 절대 바꾸지 않습니다"
    },
    {
      "id": "QL-007",
      "category": "accuracy",
      "severity": "major",
      "message": "Modal or certainty strength may have changed.",
      "segment_id": "p_006",
      "source_span": "can",
      "target_span": "이 글에서는 GitHub 저장소에 대해 동일한 설정을 단계별로 재현하는 방법을 설명합니다. 에이전트를 사용 중이라면 이 글을 참고하실 수 있는데, 인간용으로 브라우저 기반 지침과 함께 CLI 지침이 함께 제공되기 때문입니다.",
      "suggested_fix": "Preserve the strength of `can` using: 수 있습니다.",
      "reason": "The style guide requires preserving may/can/should/must/up to/in some cases/not always strength.",
      "guide_rule": "modal_strength",
      "guide_section": "4. 의미·조건·확신의 강도는 절대 바꾸지 않습니다"
    },
    {
      "id": "QL-008",
      "category": "accuracy",
      "severity": "major",
      "message": "Modal or certainty strength may have changed.",
      "segment_id": "p_029",
      "source_span": "should",
      "target_span": "이 Space를 먼저 만드는 이유는 GitHub App에 웹훅 URL이 필요하고 그 URL이 Space에서 나오기 때문입니다. 이 Space는 당신의 고유 네임스페이스 아래에 있거나 쓰기 권한이 있는 허깅페이스 org 아래에 있어야 합니다.",
      "suggested_fix": "Preserve the strength of `should` using: 좋습니다, 해야 합니다.",
      "reason": "The style guide requires preserving may/can/should/must/up to/in some cases/not always strength.",
      "guide_rule": "modal_strength",
      "guide_section": "4. 의미·조건·확신의 강도는 절대 바꾸지 않습니다"
    },
    {
      "id": "QL-009",
      "category": "accuracy",
      "severity": "major",
      "message": "Modal or certainty strength may have changed.",
      "segment_id": "p_035",
      "source_span": "can",
      "target_span": "빌드가 완료되면 복제된 Space를 엽니다. 현재는 무시해도 되는 \"Required Space secrets\" 섹션이 보일 것입니다. 다음 단계에서 필요한 GitHub App 웹훅 URL이 랜딩 페이지에 표시되어야 하며, 아래와 같은 형태일 것입니다:",
      "suggested_fix": "Preserve the strength of `can` using: 수 있습니다.",
      "reason": "The style guide requires preserving may/can/should/must/up to/in some cases/not always strength.",
      "guide_rule": "modal_strength",
      "guide_section": "4. 의미·조건·확신의 강도는 절대 바꾸지 않습니다"
    },
    {
      "id": "QL-010",
      "category": "accuracy",
      "severity": "major",
      "message": "Modal or certainty strength may have changed.",
      "segment_id": "p_035",
      "source_span": "should",
      "target_span": "빌드가 완료되면 복제된 Space를 엽니다. 현재는 무시해도 되는 \"Required Space secrets\" 섹션이 보일 것입니다. 다음 단계에서 필요한 GitHub App 웹훅 URL이 랜딩 페이지에 표시되어야 하며, 아래와 같은 형태일 것입니다:",
      "suggested_fix": "Preserve the strength of `should` using: 좋습니다, 해야 합니다.",
      "reason": "The style guide requires preserving may/can/should/must/up to/in some cases/not always strength.",
      "guide_rule": "modal_strength",
      "guide_section": "4. 의미·조건·확신의 강도는 절대 바꾸지 않습니다"
    },
    {
      "id": "QL-011",
      "category": "accuracy",
      "severity": "major",
      "message": "Modal or certainty strength may have changed.",
      "segment_id": "p_043",
      "source_span": "should",
      "target_span": "설정 양식에서 허깅페이스 Jobs에서 CI가 실행되도록 하는 GitHub 리포를 입력합니다:",
      "suggested_fix": "Preserve the strength of `should` using: 좋습니다, 해야 합니다.",
      "reason": "The style guide requires preserving may/can/should/must/up to/in some cases/not always strength.",
      "guide_rule": "modal_strength",
      "guide_section": "4. 의미·조건·확신의 강도는 절대 바꾸지 않습니다"
    },
    {
      "id": "QL-012",
      "category": "accuracy",
      "severity": "major",
      "message": "Modal or certainty strength may have changed.",
      "segment_id": "p_044",
      "source_span": "can",
      "target_span": "그런 다음 GitHub App 생성을 위한 버튼을 클릭합니다. GitHub은 App의 이름을 선택하라고 묻습니다. 이름은 GitHub 계정이나 조직에서 사용 가능하면 무엇이든 상관없습니다. 제출하면 최종 화면에 hf CLI를 사용해 dispatcher Space에 App 자격 증명을 업로드하는 정확한 방법이 표시됩니다.",
      "suggested_fix": "Preserve the strength of `can` using: 수 있습니다.",
      "reason": "The style guide requires preserving may/can/should/must/up to/in some cases/not always strength.",
      "guide_rule": "modal_strength",
      "guide_section": "4. 의미·조건·확신의 강도는 절대 바꾸지 않습니다"
    },
    {
      "id": "QL-013",
      "category": "accuracy",
      "severity": "major",
      "message": "Modal or certainty strength may have changed.",
      "segment_id": "p_052",
      "source_span": "should",
      "target_span": "이 시점에서 dispatcher Space가 구성되어 있어야 합니다. GitHub App 설정 흐름은 Space에 App 자격 증명, 웹훅 시크릿 및 허깅페이스 토큰을 업로드하는 명령을 생성합니다.",
      "suggested_fix": "Preserve the strength of `should` using: 좋습니다, 해야 합니다.",
      "reason": "The style guide requires preserving may/can/should/must/up to/in some cases/not always strength.",
      "guide_rule": "modal_strength",
      "guide_section": "4. 의미·조건·확신의 강도는 절대 바꾸지 않습니다"
    },
    {
      "id": "QL-014",
      "category": "accuracy",
      "severity": "major",
      "message": "Modal or certainty strength may have changed.",
      "segment_id": "p_064",
      "source_span": "should",
      "target_span": "일반적인 GitHub Action처럼 로그를 확인할 수 있어야 합니다—예를 들어 이 Trackio PR #565에서.",
      "suggested_fix": "Preserve the strength of `should` using: 좋습니다, 해야 합니다.",
      "reason": "The style guide requires preserving may/can/should/must/up to/in some cases/not always strength.",
      "guide_rule": "modal_strength",
      "guide_section": "4. 의미·조건·확신의 강도는 절대 바꾸지 않습니다"
    },
    {
      "id": "QL-015",
      "category": "accuracy",
      "severity": "major",
      "message": "Modal or certainty strength may have changed.",
      "segment_id": "p_077",
      "source_span": "can",
      "target_span": "CPU 결과도 고무적이었습니다. 올바른 이미지로 Linux 테스트 작업은 GitHub 호스팅 기준선보다 빨랐습니다. 이는 허깅페이스 Jobs가 특히 맞춤 이미지나 가속기가 필요한 머신 러닝 프로젝트에 실용적인 CI 백엔드가 될 수 있음을 시사합니다.",
      "suggested_fix": "Preserve the strength of `can` using: 수 있습니다.",
      "reason": "The style guide requires preserving may/can/should/must/up to/in some cases/not always strength.",
      "guide_rule": "modal_strength",
      "guide_section": "4. 의미·조건·확신의 강도는 절대 바꾸지 않습니다"
    },
    {
      "id": "QL-016",
      "category": "accuracy",
      "severity": "major",
      "message": "Translation may add a causal explanation that is not in the source.",
      "segment_id": "p_079",
      "source_span": "",
      "target_span": "때문에",
      "suggested_fix": "Remove invented causal explanation unless the source explicitly states it.",
      "reason": "The style guide forbids adding technical explanations, reasons, examples, or conclusions.",
      "guide_rule": "information_addition",
      "guide_section": "5. 정보 추가는 원칙적으로 금지하되, 연결 문장은 허용합니다"
    },
    {
      "id": "QL-017",
      "category": "fluency",
      "severity": "minor",